,text
152,"Accordingly, the district court dismissed the lawsuit for failing to state a claim for relief under the Second Amendment, reasoning that it ""would be in error to overlook sixty-five years of unchanged Supreme Court precedent and the deluge of circuit case law rejecting an individual right to bear arms not in conjunction with service in the Militia."" Parker v.
And as for the kind of weapons that may obtain Second Amendment protection, the Court noted that Miller limits Second Amendment coverage to weapons ""in common use at the time"" that the reviewing court is examining a particular firearm, which, the Court added, ""is fairly supported by the historical tradition of prohibiting the carrying of dangerous and unusual weapons."" Second Amendment Analysis of D.C.'s Firearms Regulations Finally, the Supreme Court applied the Second Amendment, as newly interpreted, to the contested D.C. firearm regulations—which amounted to a near-total handgun ban—and concluded that they were unconstitutional.
First, the Court declared that possessing weapons for self-defense is ""central to the Second Amendment right,"" yet the District's handgun ban prohibits ""an entire class of 'arms' that is overwhelmingly chosen by American society for that lawful purpose."" Moreover, the handgun prohibition extended into the home, where, the Court added, ""the need for defense of self, family, and property is most acute."" Additionally, the requirement that firearms in the home be kept inoperable is unconstitutional because, the Court concluded, that requirement ""makes it impossible for citizens to use them for the core lawful purpose of self-defense."" Thus, the Court ruled, the District's handgun ban could not survive under any level of scrutiny that a court typically would apply to a constitutional challenge of an enumerated right.
Justice Breyer suggested an interest-balancing inquiry in which a court would evaluate ""the interests protected by the Second Amendment on one side and the governmental public-safety concerns on the other, the only question being whether the regulation at issue impermissibly burdens the former in the course of advancing the latter."" In making that evaluation, Justice Breyer would ask ""how the statute seeks to further the governmental interests that it serves, how the statute burdens the interests that the Second Amendment seeks to protect, and whether there are practical less burdensome ways of furthering those interests."" Applying those questions to the challenged D.C. laws, Justice Breyer concluded that (1) the laws sought to further compelling public-safety interests; (2) the D.C. restrictions minimally burdened the Second Amendment's purpose to preserve a ""well regulated Militia"" and burdened ""to some degree"" an interest in self-defense; and (3) there were no reasonable but less restrictive alternatives to reducing the number of handguns in the District.
warrant[s] characterizing it as 'fundamental' insofar as it seeks to protect the keeping and bearing of arms for private self-defense purposes."" Additionally, he asserted that the Constitution provides no authority for ""transferring ultimate regulatory authority over the private uses of firearms from democratically elected legislators to courts or from the States to the Federal Government."" Justice Stevens authored another dissenting opinion, arguing that the question before the Court was not whether the Second Amendment, as a whole, applies to the states, but rather whether the Fourteenth Amendment requires that the liberty interest asserted—""the right to possess a functional, personal firearm, including a handgun, within the home""—be enforceable against the states.
It is also worth noting that, although the D.C. Circuit has applied the two-step approach when evaluating firearm legislation, the newest member of the Supreme Court bench—Justice Kavanaugh—advocated for a different approach while serving as a judge on the D.C. Circuit, arguing that: ""In my view,"" he stated, "" Heller and McDonald leave little doubt that courts are to assess gun bans and regulations based on text, history, and tradition, not by a balancing test such as strict or intermediate scrutiny.""  Step One: Scope of Second Amendment Protection The first question in the two-part framework asks whether the challenged law targets conduct within the scope of the Second Amendment's protections.
At step two, the court applied intermediate scrutiny, concluding that the age-based restriction does not burden the Second Amendment's core protections of law-abiding, responsible citizens, because ""Congress found that persons under 21 tend to be relatively irresponsible and can be prone to violent crime, especially when they have easy access to handguns."" Nor does the restriction prevent 18- to 21-year-olds from possessing handguns for self-defense in the home because, the court added, these persons may lawfully acquire handguns from responsible parents or guardians.
Staten, the Fourth Circuit concluded that there is a reasonable fit between § 922(g)(9) and a substantial governmental interest—reducing domestic gun violence—because the government had established that domestic violence in the United States is a serious problem with high rates of recidivism, and, additionally, the ""use of firearms in connection with domestic violence is all too common.""  Another circuit court, however, concluded that § 922(g)(9) is a presumptively lawful prohibition on the possession of firearms that need not be evaluated under a particular level of scrutiny.
White reasoned that § 922(g)(9) was passed, in part, because Congress had recognized that domestic violence with firearms had not been remedied by ""longstanding felon-in-possession laws,"" and thus the court ""s[aw] no reason to exclude § 922(g)(9) from the list of longstanding prohibitions on which Heller does not cast doubt."" Additionally, the Seventh Circuit sitting en banc and using its unique approach upheld § 922(g)(9) as constitutional after concluding that the government made a ""strong showing"" that § 922(g)(9) is substantially related to an important governmental objective.
Intermediate scrutiny was appropriate because, the court reasoned, a person subject to a domestic violence restraining order is not entitled to the benefit of the ""core right identified in Heller —the right of a law-abiding, responsible citizen to possess and carry a weapon for self-defense."" In applying intermediate scrutiny the Fourth Circuit concluded that the government established a reasonable fit between § 922(g)(8) and the government's substantial interest in reducing domestic gun violence.
to leave the premises and use [a firearm] against those that sought the protections of the protective order."" The court did not find it relevant that the defendant did not actually leave the shooting range with the handgun and incite violence, because the intermediate scrutiny standard of review applicable to the challenged restriction, in the court's view, ""has never been held to require a perfect end-means fit."" Accordingly, the court concluded that ""[i]t is sufficient that § 922(g)(8) rests on an established link between domestic abuse, recidivism, and gun violence and applies to persons already individually adjudged in prior protective order to pose a future threat of abuse."" Unlawful Drug Users and Addicts 18 U.S.C.
Unlike in other cases, the government had not provided any studies, empirical data, or legislative findings to support the restriction, and instead it had argued that ""the fit was a matter of common sense."" However, the court noted that the government's burden on remand ""should not be difficult to satisfy,"" given that evidence of danger of mixing drugs and guns was, in the court's view, ""abundantly available."" And on remand, the government indeed presented numerous studies showing a correlation between violent crime and drug use, which the Fourth Circuit ultimately found to substantiate the government's contention that ""disarming drug users reasonably serves the important governmental interest of protecting the community from gun violence."" Aliens Another provision of the Gun Control Act, 18 U.S.C.
Huitron-Guizar assumed that unlawfully present aliens, like the defendant—who also had been in the United States for decades and was brought to the country as a young child—could assert a Second Amendment right, noting that ""we hesitate to infer from Heller a rule that the right to bear arms is categorically inapplicable to non-citizens."" Applying intermediate scrutiny to § 922(g)(5), the court concluded that the law is constitutional, deferring to Congress's ""constitutional power to distinguish between citizens and non-citizens, or between lawful and unlawful aliens, and to ensure safety and order."" Ultimately, the court found a substantial fit between the government's interests in crime control and public safety, and its desire to keep firearms out of the hands of those it deems as ""irresponsible or dangerous.""  What Categories of Firearms May Be Subject to Government Regulation?
The court concluded that banning a certain type of ammunition does not substantially burden the Second Amendment right to use firearms for self-defense because the restriction burdens only the manner in which that right is exercised, and thus ought to be reviewed under intermediate scrutiny.
The circuit court found that, although the law implicates the core of the Second Amendment right by imposing restrictions on the use of handguns in the home, unlike the former D.C. law evaluated in Heller requiring handguns to be made completely inoperable, the burden in San Francisco's law was not substantial, and thus intermediate scrutiny was warranted.
Moreover, the court noted that, although the law makes it more difficult for residents to use handguns for self-defense in the home by having to retrieve the firearm from a locked container or remove a trigger lock, the requirement still burdens only the manner in which persons exercise their Second Amendment right.
Justice Thomas described Jackson as ""in serious tension with Heller "" by prohibiting San Francisco residents from keeping their handguns ""'operable for the purpose of immediate self-defense,' when not carried on their person."" Justice Thomas added that such a burden on a core Second Amendment right ""is significant,"" stating that ""nothing in our decision in Heller suggested that a law must rise to the level of the absolute prohibition at issue in that case to constitute a 'substantial burden' on the core of the Second Amendment right."" Government Property Challenges brought against firearm prohibitions on federal property raise the question of whether such prohibitions fall into Heller's safe harbor for ""sensitive places."" For instance, by regulation, firearms are prohibited on U.S. postal property."
153,"Introduction Social Security is a self-financing program that provides monthly cash benefits to retired or disabled workers and their family members and to the family members of deceased workers.
Before the Old-Age Insurance program was in full operation, the Social Security Amendments of 1939 shifted the emphasis of Social Security from protection of the individual worker to protection of the family by extending monthly cash benefits to the dependents and survivors of workers.
The trustees project that the trust funds will have a positive balance (asset reserves) until 2035, allowing Social Security benefits scheduled under current law to be paid in full and on time until then.
For illustration purposes, the trustees point out that the following cha nges would be needed for the trust funds to remain solvent throughout the 75-year projection period: (1) an immediate 2.70-percentage-point increase in the payroll tax rate (from 12.40% to 15.10%); or (2) an immediate 17% reduction in benefits for all current and future beneficiaries; or (3) some combination of these approaches.
Rather, the program relies on revenues collected for Social Security purposes in previous years that were used by the federal government at the time for other (non-Social Security) spending needs and interest income earned on trust fund investments.
Table 3 provides a summary of Social Security benefits payable to the family members of a retired, disabled, or deceased worker."
154,"Member Pay: Constitutional Background, Source of Appropriations, and Current Rates Article I, Section 6, of the U.S. Constitution, states that the compensation of Members of Congress shall be ""ascertained by law, and paid out of the Treasury of the United States."" Additionally, the Twenty-Seventh Amendment to the Constitution states, ""No law, varying the compensation for the services of the Senators and Representatives, shall take effect, until an election of Representatives shall have intervened."" This amendment was submitted to the states on September 25, 1789, along with 11 other proposed amendments, 10 of which were ratified and became the Bill of Rights.
Selected CRS Products This report provides historical tables on the rate of pay for Members of Congress since 1789; details on enacted legislation with language prohibiting the automatic annual pay adjustment since the most recent adjustment; the adjustments projected by the Ethics Reform Act as compared with actual adjustments in Member pay; and Member pay in constant and current dollars since 1992.
Additional CRS products also address pay and benefits for Members of Congress: For information on actions taken each year since the establishment of the Ethics Reform Act adjustment procedure, see CRS Report 97-615, Salaries of Members of Congress: Congressional Votes, 1990-2018 , by Ida A.
The House-passed and Senate-reported versions of the FY2016 legislative branch appropriations bill ( H.R. 2250 ) both contained a provision prohibiting this adjustment.
Member Pay: Other Proposals and Actions by Congress  116th Congress As in previous Congresses, legislation was introduced in the 116 th Congress to repeal the automatic pay adjustment provision (for example, H.R. 751 and H.R. 1466 ); change the procedure by which pay for Members of Congress is adjusted or disbursed by linking it to congressional actions or economic indicators, including passage of a budget resolution, passage of appropriations, or reaching the debt limit (for example, S.
115th Congress  Legislation was introduced in the 115 th Congress to prohibit adjustments in pay (for example, H.R. 342 ); repeal the automatic pay adjustment provision (for example, H.R. 668 and H.R. 5946 ); change the procedure by which pay for Members of Congress is adjusted or disbursed by linking it to congressional actions or economic indicators, including passage of a budget resolution or reaching the debt limit (for example, H.R. 429 , H.R. 536 , H.R. 646 , H.R. 1779 , H.R. 1951 , H.R. 2153 , H.R. 2665 , H.R. 3675 , H.R. 4512 , and H.R. 5946 , and S.
65 , and H.R. 398 ); change the procedure by which pay for Members of Congress is adjusted or disbursed by linking it to congressional actions or economic indicators, including passage of a budget resolution or reaching the debt limit (for example, H.R. 108 , H.R. 167 , H.R. 284 , H.R. 308 , H.R. 310 , H.R. 325 , H.R. 372 , H.R. 397 , H.R. 396 , H.R. 522 , H.R. 593 , H.R. 1884 , H.R. 2335 , H.R. 3234 , S."
155,"The federal budget is constructed in a manner that provides for lower net deficits in more robust economic conditions, attributable to higher revenues (from taxes on increased output) and, to a smaller degree, lower spending levels (from reduced demand for programs like unemployment insurance).
From FY1969 to FY2018, annual nominal budget deficits and surpluses of the federal government summed to $13.745 trillion; over the same period, total debt held by the public increased by $15.473 trillion.
Deficit financing, or payment for federal government activity at least partly through debt increases, increases the total level of spending in the economy.
(3) ΔY= f(ΔL, ΔK, ΔA) Assuming that the stock of labor is insensitive to fiscal policy choices, the effect of federal debt on economic growth depends on how the additional government activity affects the capital stock and productivity of labor and capital relative to what would have happened had amounts borrowed been invested privately or increased net exports.
For instance, from FY2009 through FY2018, federal deficits averaged 5.3% of GDP, and real economic growth averaged 1.76% per year over the same period; those factors combined to increase federal publicly held debt from 39% of GDP at the beginning of FY2008 to 78% of GDP at the end of FY2018.
CBO projects increases in both interest rates and publicly held federal debt over the next 10 years, leading to a significant rise in U.S. net interest payments."
156,"The report closes with considerations for Congress in conducting its oversight role over U.S. funded anti-corruption efforts in the region and pursuing the policy objective of broadening the rule of law and encouraging good government.
The number of grand-scale scandals exposed in recent years in the region, such as payoff schemes involving high court justices and top-level officials, has led some voters to conclude that all parties and politicians are corrupt, resulting in presidents and vice presidents being pushed from office and traditional political parties being viewed as corrupt and illegitimate.
These anti-corruption campaigns may prove more enduring, however, as civil society organizations are attempting to build on their preliminary successes by pushing for institutional reforms to enhance transparency and accountability throughout the public sector.
Early Anti-corruption Approaches  U.S. foreign assistance programs to bolster rule of law, encourage good governance, and eliminate bribery, extortion, and graft have been common in Latin America for about three decades.
Anti-corruption programming sponsored by the United States and major international financial institutions grew out of ferment in the 1970s, when the long-time practice of businesses and foreign corporations paying bribes to gain contracts in developing countries was exposed (see textbox on Select International Efforts to Combat Corruption).
In 1997, the Organization for Economic Cooperation and Development (OECD), with strong support from the United States, adopted the Convention on Combating Bribery of Foreign Public Officials in International Business Transactions.
In addition, an array of former high-level government officials in Brazil, such as Aécio Neves, a former senator, governor, and 2014 presidential candidate for the Brazilian Social Democracy Party, face investigations for taking Odebrecht bribes for favorable consideration of legislation preferred by Odebrecht.
For several years, U.S. foreign assistance has been provided to fight corruption and enhance the rule of law in Latin America (including judicial training), to improve law-enforcement techniques to conduct investigations, make arrests and properly handle evidence, and enhance oversight of civil society for better accountability.
Relevant assistance provided by the U.S. government to combat corruption includes assistance and efforts by U.S. State Department, the United States Agency for International Development (USAID), the Department of Justice, the Department of the Treasury, and the Millennium Challenge Corporation (MCC), outlined below.
Anti-corruption activities are integrated in the strategy of each USAID country mission and embassy, and therefore may influence programs beyond democracy and good governance to include such areas as health, education, economic growth, and promotion of environmental and natural resources management.
Some funds for anti-corruption and justice programs abroad involve transfers from the State Department to the U.S. Department of Justice (DOJ), such as the International Criminal Investigative Training Assistance Program (ICITAP), which is a law enforcement development agency.
In Mexico, the United States has supported rule of law reforms to increase judicial independence, reduce impunity, and protect journalists in the context of a strong central government.
U.S. efforts have included programs aimed at supporting the country's transition to an accusatorial justice system, establishing a National Anti-corruption System (NAS), bolstering transparency and oversight of government programs, and supporting investigative journalism.
U.S. assistance (1) has helped the federal and state governments adopt legislative frameworks to underpin the reform process, (2) provided in-depth training for justice sector operators on their roles in the system, and (3) built support for the reforms in Mexican civil society.
National Anticorruption System and Related Efforts to Improve Transparency  In 2015, the Mexican congress approved and President Peña Nieto signed constitutional reforms creating a system to prevent and punish corruption following intense and sustained lobbying by civil society and the private sector.
USAID has provided support to Mexican government (federal and state) anti-corruption and public administration entities, as well as efforts organized by private sector and civil society groups.
An independent, international entity, CICIG's mandate is to support, strengthen and assist Guatemalan state institutions in investigating, prosecuting, and dismantling illegal groups and clandestine structures responsible for organized crime, human rights violations and other crimes, and to propose effective legal reforms.
In its annual report on drug policy, the U.S. State Department highlighted these accomplishments and concerns in March 2019:  Guatemala's Attorney General and the UN-backed International Commission Against Impunity in Guatemala (CICIG) have investigated hundreds of government officials suspected of corruption.
Mission to Support the Fight Against Corruption and Impunity in Honduras115 U.S. policy in Honduras is guided by the U.S. Strategy for Engagement in Central America, which is intended to promote economic prosperity, strengthen governance, and improve security in the region, and thereby mitigate migration and security threats to the United States.
MACCIH officials also are working alongside a recently established anti-corruption unit within the public prosecutor's office ( Unidad Fiscal Especial Contra la Impunidad de la Corrupción , UFECIC) to jointly investigate and prosecute high-level corruption cases.
Their anti-corruption efforts are likely to face sustained resistance from all three branches of the Honduran government, however, and further progress will likely require continued financial and diplomatic support from the United States and other international donors.
In Mexico, the United States has worked for years to strengthen the Mexican justice system and help to reform it, and also to support an integrated anti-corruption system, although both new systems have only partially been put into practice.
In August 2018, Congress enacted the FY2019 defense authorization measure, P.L. 115-232 ( H.R. 5515 ), with several Latin America provisions, which include required reports on narcotics trafficking, corruption, and illicit campaign financing in El Salvador, Guatemala, and Honduras, including identifying government officials involved in such activities.
The Trump Administration has rarely applauded civil society activism in Latin America and Caribbean countries in response to high-level scandals and public corruption.
The Americas program at the Center for Strategic and International Studies (CSIS), recommends key targets for reform in the region, which are: (1) political party and campaign financing; (2) public financial sector management; (3) government contracting and procurement, especially for critical infrastructure; (4) civil service reform and effective vetting of public officials; and (5) internal strengthening and oversight of public security and justice institutions."
