,text
102,"In his May 28, 2004, report following the vote, Annan said that ""the Greek Cypriots' vote must be respected, but they need to demonstrate willingness to resolve the Cyprus problem through a bicommunal, bizonal federation and to articulate their concerns about security and implementation of the Plan with 'clarity and finality.'"" The Christofias-Talat Negotiations: 2008-2010 As early as 2004, Talat, as Turkish Cypriot ""prime minister,"" was credited with helping convince the Turkish Cypriots to support the Annan Plan and had been seen as perhaps the one Turkish Cypriot leader who could move the Greek Cypriots toward a more acceptable solution for both sides.
After Christofias's election, Turkish Cypriot leader Talat, a long-time acquaintance of Christofias, declared that ""a solution in Cyprus is possible by the end of 2008."" He also declared that ""the goal was to establish a new partnership state in Cyprus, based on the political equality of the two peoples and the equal status of two constituent states."" While the negotiations between Christofias and Talat appeared to get off to a fast start, the differences in positions quickly became apparent, and the talks, although held on a regular basis, soon began to bog down.
Almost immediately, a controversy arose when it was reported that Downer read a statement from U.N. Secretary-General Ban congratulating the parties for starting the talks again from where they left off (including the confirmation of existing convergences agreed to by Christofias and Talat), for agreeing to abide by U.N. Security Council resolutions on Cyprus, and for suggesting that a final agreement could be reached in the coming months.
On the other hand, apparently after the May 26 meeting, Eroglu made a statement that the Turkish Cypriots would not be bound by the statement of the U.N. Secretary-General, especially with regard to previous U.N. Security Council resolutions, some of which did include calls for Turkey to withdraw its troops from Cyprus.
""As time passes,"" he said, ""the willingness of the two communities to live together is diminishing."" For his part, Christofias told the U.N. Secretary-General in September 2010 that both sides were not coming closer to a settlement and that Turkey, given its own domestic and regional problems, ""was not ready to solve the Cyprus problem."" Although assessments of the negotiations appeared to grow more pessimistic, additional sessions were held through the end of December.
Ban had asked both Christofias and Eroglu to come to New York on January 22-24 with significant offers in the areas of governance, economy, and EU affairs so that the ""Greentree 2"" meeting could facilitate a final deal that would allow the U.N. to convene an international conference in the spring to resolve security-related issues and allow referenda on a final agreement in both the north and south by early summer of 2012.
It appeared, however, that even before arriving in New York, neither Christofias nor Eroglu was willing or able to make necessary concessions on the difficult issues of property rights, security, territory, mainland Turks who had ""settled"" in the north, or citizenship—areas where both sides had long-held and very different positions.
The lack of any progress to that point led some in the Greek Cypriot opposition to suggest the meeting be cancelled and warned Christofias not to accept any deadlines or U.N. arbitration or agree to an international conference without explicit agreements on internal issues.
While foreclosing new discussions based on the old Annan Plan, Anastasiades had suggested that the basis of future talks would have to be broad understandings reached in 1977 and 1979 between the Greek and Turkish Cypriot leadership at the time as well as a 2006 set of principles agreed to by former Cypriot leaders.
On the other hand, Yiannakis Omirou, then-leader of the parliament, stated that a new national policy was necessary: ""We need to denounce the Turkish stance to the international and European community and redefine the Cyprus problem as a problem of invasion, occupation and violation of international law."" The new policy, Omirou went on, ""must set out the framework for a Cyprus solution and use Cyprus's EU membership and Turkey's EU prospects to exert pressure on Ankara to terminate the island's occupation and accept a solution, in accordance with international and European law."" Initially, the Turkish Cypriots appeared cautious about which negotiating partner they expected to see across the table if and when the talks resumed.
On February 8, 2014, after what appeared to be a significant intervention by the United States, the Cyprus press reported that an agreement on the language of a ""joint declaration"" had been reached and that Anastasiades and Eroglu would meet right away to relaunch the negotiations.
Such a long disagreement first over the need for, and then the language of, the joint statement indicated to many observers that it would continue to be difficult to reach a final solution, particularly in 2014, which marked the 40 th anniversary of the 1974 deployment of Turkish military forces to the island and the 10 th anniversary of the Greek Cypriot vote against the Annan Plan, events that would be observed in very different ways on each side of the island.
These and other reported roadblocks to the negotiations prompted Greek Prime Minister Antonis Samaras to say in July that no ""significant progress"" had been made and the Turkish Cypriot official for foreign affairs, Ozdil Nami, to suggest ""the peace talks were finished.""  The last meeting between Anastasiades and Eroglu before a break for the summer was held on July 26 and was reportedly a somewhat tense session, with Anastasiades expressing his frustration with the Turkish Cypriot side.
Reacting to Turkey's decision to establish a presence in the Cypriot EEZ, President Anastasiades announced in October that he was withdrawing from the settlement negotiations and declared that the talks would not resume until the Turkish seismic vessel was withdrawn from Cyprus's EEZ and the NAVTEX was rescinded.
Although the Greek Cypriots insisted that all of the island would eventually benefit from any resources exploited in the waters off the coast, they pointed out that energy, under the provisions of the joint statement agreed to earlier, would be considered a ""federal-level"" issue and would become part of the dialogue once an agreement was reached.
The suspension of the talks, precipitated for some by an unnecessary action and a possible overreaction, again raised serious doubts regarding the commitment of both sides to achieve a solution that left one former British foreign secretary stating that ""the international community should accept the reality that there is division and that you have partition.""  Through the first four months of 2015, the talks remained in suspension with Anastasiades continuing to hold that Turkey would have to withdraw its seismic ship, rescind the NAVTEX issued in January, and stop threatening existing energy exploration activities off the southern coast of Cyprus.
For instance, in early September 2015 several Greek Cypriot political parties officially rejected the notion of a bizonal, bicommunal federation as a part of the solution to the Cyprus problem and criticized reported convergences on population size in the north, the rotating presidency, and particularly Turkey's security role.
Some believed that he retained his father's hard-line skepticism of any deal and had suggested that if an agreement was not reached by the end of 2016, a referendum should be held in the north to determine whether the Turkish Cypriots wanted the negotiations to continue in 2017.
The idea was to achieve enough progress by then on many of the basic issues that both sides would then ask the U.N. Secretary-General to convene a five-party conference (with the two Cypriot communities and the security guarantee countries, Greece, Turkey, and the UK) in December to discuss the issue of security guarantees and finalize an agreement.
Although no five-party conference was announced at the U.N. meeting, the two leaders returned to Cyprus and agreed to another series of accelerated sessions in October and November, to further address the issue of territory and to move to a multiparty conference on security guarantees with the intention of finalizing an agreement.
Ankara's decision led some to wonder if its presence at Geneva was merely intended to reinforce Akinci's earlier demands that Anastasiades agree to such a conference or to demonstrate that Turkey, despite Greek Cypriot claims that Ankara was not interested in a solution, was indeed willing to continue negotiations.
The Geneva meetings apparently began on a positive note with what was reported to be a convergence on the sticking point of a rotating presidency and even more public references to a ""United Federal Cyprus."" Nevertheless, on January 11, 2017, when both sides presented their proposed maps for territorial adjustment to the U.N., the negotiations appeared to veer off course.
Apparently realizing that the security-guarantee issue and Turkey's future role in the north would not be resolved, and with Anastasiades's rejection of the introduction of the four freedoms proposal, Turkish Foreign Minister Mevlut Cavusoglu departed Geneva.
Turkey's injection of the four freedoms issue could have been an attempt by Ankara to stall the negotiations until after the April referendum in Turkey, while Akinci still wanted Anastasiades to step back from his reported comments that the Turkish Cypriots had to face the fact of a minority status on the island.
When the two leaders met for their regularly scheduled meeting on February 16, 2017, Akinci insisted that Anastasiades reverse the parliament's decision on a commemoration of the 1950 referendum, claiming the enosis issue underscored Turkish Cypriot concerns for their safety and security after a settlement and reinforced the argument for why Turkish troops should remain in the north.
Following the announcement of the new conference in Crans Montana, U.N. Special Adviser Eide contacted officials of Greece, Turkey, the UK, and the two Cypriot parties to collect the ""bottom line"" positions of all sides on the security guarantee and troop level issues.
For Akinci, it appeared that if he could win enough concessions on issues such as political equality and a rotating presidency, and could be comfortable as a coequal partner in the future of Cyprus, he might have been able to help Turkey make the necessary concessions on security that Ankara may not have been willing to accept otherwise.
President Anastasiades indicated that he was ready to resume the negotiations, and, despite Guterres's assertion that this was not the end of the road, several news outlets reported that comments by Turkish Foreign Minister Cavusoglu suggested a Turkish decision to abandon the U.N. framework (bizonal, bicommunal federation) as a solution to the Cyprus problem and to move on to a ""Plan B."" Several in the Turkish Cypriot government also echoed the theme that negotiations under the current U.N. structure were over.
In May 2018, Akinci, despite his earlier comments regarding a new format for the talks, suggested negotiations could possibly resume from where they left off at Crans Montana if both sides agreed to adopt as a strategic agreement the six-point framework presented by U.N. Secretary-General Guterres on June 30, 2017.
This time, however, the Secretary-General tasked Lute to determine during her consultations whether there were grounds for the two leaders to accept what Guterres referred to as a ""terms of reference"" document that would include his original 2017 six-point framework, those issues on which both sides previously agreed ""convergences"" had been reached, and a road map for when and how new negotiations would be launched.
In April 2016, the Greek foreign minister reportedly suggested that no final agreement on Cyprus could be achieved until all Turkish military forces agreed to leave the island."
103,"The LCS program has been controversial over the years due to past cost growth, design and construction issues with the first LCSs, concerns over the survivability of LCSs (i.e., their ability to withstand battle damage), concerns over whether LCSs are sufficiently armed and would be able to perform their stated missions effectively, and concerns over the development and testing of the modular mission packages for LCSs. The LCS program has been modified or restructured several times over the years, in part to address these issues.
Supporters of procuring one or more LCSs could argue that it could provide a hedge against delays in the FFG(X) program and help the Navy achieve its small surface combatant force-level goal more quickly.
Opponents of this plan might argue that it could weaken the FFG(X) competition by offering the winner a smaller prospective number of FFG(X)s and essentially guaranteeing the LCSs yard that they will build some number of FFG(X)s; substantially increase annual FFG(X) procurement funding requirements so as to procure as many as four to six FFG(X)s per year rather than two per year, which in a situation of finite Department of Defense (DOD) funding could require offsetting reductions in other Navy or DOD programs; and reduce production economies of scale in the FFG(X) program by dividing FFG(X) among two or three designs, and increase downstream Navy FFG(X) operation and support (O&S) costs by requiring the Navy to maintain two or three FFG(X) logistics support systems.
Supporters of this perspective might argue that the costs of the rapid acquisition strategy are not offset by very much in terms of a true reduction in acquisition cycle time, because the first LCS to be equipped with a mission package that had reached IOC (initial operational capability) did not occur until late FY2014—almost 13 years after the LCS program was announced."
104,"Data fro m streamgages informs real-time decisionmaking and long-term planning on issues such as hazard preparations and response, infrastructure design, water use allocations, ecosystem management, and recreation.
Originally titled the National Streamflow Information Program (NSIP), the USGS now designates these streamgages as FPSs. Out of the 4,760 FPS locations identified by the USGS, 3,640 sites were operational in 2018.
The proposed program was to be fully federally funded, conduct intense data collection during floods and droughts, provide regional and national assessments of streamflow characteristics, enhance information delivery, and conduct methods development and research.
The law also directed the program to determine the relationship between long-term streamflow dynamics and climate change, to incorporate principals of adaptive management to assess program objectives, and to integrate data collection activities of other federal agencies (i.e., NOAA's National Drought Information System) and appropriate state water resource agencies.
Funding for streamgages is included in the Groundwater and Streamflow Information Program under the USGS Water Resources Mission Area.
While maintaining level funding for FPS and CMF streamgages in FY2019, Congress directed increased funding of $8.5 million for the deployment and operation of NextGen water observing equipment.
The FY2020 budget request states that ""one of the highest goals of the USGS is to maintain long-term stability of a 'Federal needs backbone network' for long-term tracking and forecasting/modeling of streamflow conditions."" Some stakeholders may advocate to maintain the current network as it provides hydrologic information for diverse applications (see section on "" Streamgage Uses "").
If inflation increases costs, level funding may not fully maintain the current operations of FPSs. In addition, 71% of the network, including some FPSs, are funded by other federal and nonfederal partners, which makes those streamgages potentially vulnerable for discontinuation.
While some stakeholders have advocated for Congress to provide full appropriations for FPSs to meet the mandate based on network needs, Congress may consider other funding priorities (e.g., the NextGen system).
Congress may also consider if other federal agencies and nonfederal cooperative partners could provide more funding for FPSs. These entities may not be interested in financing some of the designated streamgages in the FPS network, particularly those in isolated river basins with little anthropogenic activity."
105,"A key aspect of eligibility for major farm revenue support programs is the requirement that a person be ""actively engaged in farming"" (AEF)—that is, that a person contribute either labor or management time (or both) to the farm's operation.
This is followed by a description of a 2015 USDA rule—released subsequent to the 2014 farm bill ( P.L. 113-79 )—that clarifies what constitutes AEF for nonfamily members of a farming operation, how more than one nonfamily person may qualify as an active farm manager (subject to a limit of three farm managers), and the recordkeeping requirements necessary to meet this new criteria.
In 2004, GAO contended that USDA regulations failed to specify a measurable standard for what constituted ""a significant contribution of active personal management."" Furthermore, GAO argued that, by not specifying such a measurable standard, USDA allowed individuals with little or no involvement in a farming operation to qualify for payments.
Critics contend that current USDA eligibility criteria—especially for providing active personal management—remain broad and subjective and may represent a low threshold to qualify for payments, thus facilitating the creation of partnership members to increase the farm business's payment limit and expand its farm payment receipts.
The resulting USDA rule, published on December 16, 2015, specifies how legal entities comprised, either entirely or in part, of nonfamily members may be determined eligible for payments, based on a contribution of active personal management.
In particular, some advocacy groups suggest that USDA's new rule did not go far enough in tightening AEF criteria and that it continues to allow for a high number of farm managers and associated payment limits for both family and nonfamily farm operations.
These concerns include the lack of specificity in eligibility criteria that continues to allow for as many as three nonfamily farm managers (each, plus their spouses, qualifying for a full payment limit) and no limit on the number of potential farm managers from family-held farm operations."
106,"In April 2015, the United Nations Security Council passed Resolution (UNSCR) 2216 demanding that Houthi-Saleh forces end their use of violence and that all Yemeni parties avoid ""further unilateral actions that could undermine the political transition in Yemen."" The United States agreed to provide limited assistance to the coalition military operations, assistance which has evolved over time in response to conditions in the conflict and in light of congressional scrutiny.
For the Trump Administration, U.S. officials have supported the continued defense of Saudi Arabia against Houthi missile and rocket strikes, while also openly calling on coalition members to use air power judiciously to minimize civilian casualties.
The United States will continue to press the coalition and the Republic of Yemen government to minimize civilian casualties and expand urgent humanitarian efforts throughout the country."" In early February 2019, CENTCOM Commander General Joseph Votel testified before the Senate Armed Services Committee regarding the U.S. role in assisting Saudi Arabia.
The foreign ministers comprising the quad also ""expressed full support for Saudi Arabia and its legitimate national security concerns and called for an immediate end to such attacks by Houthi forces and their allies."" On February 13, 2019, the House passed (248-177) H.J.Res. 37 , a joint resolution ""Directing the removal of United States Armed Forces from hostilities in the Republic of Yemen that have not been authorized by Congress."" Prior to its passage by the House, the White House issued a Statement of Administration Policy in which the Administration argued that ""the premise of the joint resolution is flawed"" because the United States has provided only ""limited support to member countries of the Saudi-led coalition"" and U.S. forces providing such intelligence and logistics support are not engaged in hostilities.
In March 2015, President Obama authorized ""the provision of logistical and intelligence support to GCC-led military operations,"" and the Obama Administration announced that the United States would establish ""a Joint Planning Cell with Saudi Arabia to coordinate U.S. military and intelligence support."" U.S. CENTCOM personnel were deployed to provide related support, and U.S. mid-air refueling of coalition aircraft began in April 2015 and ended in November 2018.
According to President Trump's December 2018 letter to Congress consistent with the War Powers Resolution, U.S. Armed Forces, ""in a non-combat role,""  continued to provide military advice and limited information, logistics, and other support to regional forces combatting the Houthi insurgency in Yemen; however, aerial refueling of regional forces' aircraft ended in November 2018."
