,text
42,"The mission of the FCC is to ensure that the American people have available, ""without discrimination on the basis of race, color, religion, national origin, or sex, a rapid, efficient, Nationwide, and worldwide wire and radio communication service with adequate facilities at reasonable charges.""  The 1934 Act is divided into titles and sections that describe various powers and concerns of the commission.
Targets and measures are published in the FCC's Performance Plan, and submitted with the commission's annual budget request to Congress.
FCC Operations: Budget, Authorization, and Reporting to Congress Since the 110 th Congress, the FCC has been funded through the House and Senate Financial Services and General Government (FSGG) appropriations bill as a single line item.
His support of this regulatory philosophy can be seen in the language used in the strategic goals, such as ""reducing regulatory burdens"" and ensuring that ""regulations reflect the realities of the current marketplace, promote entrepreneurship, expand economic opportunity, and remove barriers to entry and investment.""  The use of this particular language may seem somewhat vague, but within the context of the net neutrality debate, discussed below, and the replacement of the Office of Strategic Planning and Policy Analysis with the Office of Economics and Analytics, those words take on more specific meaning, each intending to support the policy agenda of the Chairman.
The new Office of Economics and Analytics is ""responsible for expanding and deepening the use of economic analysis into FCC policy making, for enhancing the development and use of auctions, and for implementing consistent and effective agency-wide data practices and policies."" This new office reflects the goals in the current strategic plan:  We will modernize and streamline the FCC's operations and programs to … reduce regulatory burdens…."
43,"20-Year Funding Trends  Table 3 and Figure 1 provide the funding levels for enduring funds and Supplemental/OCO funds in the Department of State, Foreign Operations and Related Programs for FY2001-2020 request (in current dollars).
In contrast to emergency supplemental appropriations, the Obama Administration included within the regular budget request in FY2012 what it described as short-term, temporary, war-related funding for the frontline states of Iraq, Afghanistan, and Pakistan—designated as Overseas Contingency Operations funds, or OCO."
44,"For example, during the 111 th Congress P.L. 111-5 , the American Recovery and Reinvestment Act of 2009 (ARRA), provided the SBA an additional $730 million, including $375 million to temporarily subsidize the 7(a) and 504/Certified Development Companies (504/CDC) loan guaranty programs' fees ($299 million) and to temporarily increase the 7(a) program's maximum loan guaranty percentage to 90% ($76 million).
P.L. 111-240 , the Small Business Jobs Act of 2010, provided $505 million (plus $5 million for administrative expenses) to extend the fee subsidies and 90% loan guaranty percentage through December 31, 2010; increased the 7(a) program's gross loan limit from $2 million to $5 million; and established an alternative size standard for the 7(a) and 504/CDC loan programs to enable more small businesses to qualify for assistance.
P.L. 111-322 , the Continuing Appropriations and Surface Transportation Extensions Act, 2011, authorized the SBA to continue the fee subsidies and the 7(a) program's 90% maximum loan guaranty percentage through March 4, 2011, or until available funding was exhausted (which occurred on January 3, 2011).
P.L. 115-189 , the Small Business 7(a) Lending Oversight Reform Act of 2018, among other provisions, codified the SBA's Office of Credit Risk Management; required that office to annually undertake and report the findings of a risk analysis of the 7(a) program's loan portfolio; created a lender oversight committee within the SBA; authorized the Director of the Office of Credit Risk Management to undertake informal and formal enforcement actions against 7(a) lenders under specified conditions; redefined the credit elsewhere requirement; and authorized the SBA Administrator to increase the amount of 7(a) loans not more than once during any fiscal year to not more than 115% of the 7(a) program's authorization limit.
The act clarified that 7(a) loans to ESOPs may be made under the Preferred Lenders Program; allows the seller to remain involved as an officer, director, or key employee when the ESOP or cooperative has acquired 100% ownership of the small business; and authorizes the SBA to finance transition costs to employee ownership and waive any mandatory equity injection by the ESOP or cooperative to help finance the change of ownership.
The SBA directs lenders to not decline a loan solely on the basis of inadequate collateral because ""one of the primary reasons lenders use the SBA-guaranteed program is for those Applicants that demonstrate repayment ability but lack adequate collateral to repay the loan in full in the event of a default."" Lender Eligibility Standards and Program Requirements Lender Eligibility Standards Lenders must have a continuing ability to evaluate, process, close, disburse, service, and liquidate small business loans; be open to the public for the making of such loans (and not be a financing subsidiary, engaged primarily in financing the operations of an affiliate); have continuing good character and reputation; and be supervised and examined by a state or federal regulatory authority, satisfactory to the SBA.
SBA form 1919 provides information about the borrower (name, name of business, social security number, date and place of birth, gender, race, veteran, etc.); the loan request; any indebtedness; the principals and affiliates; current or previous government financing; the applicant's eligibility (e.g., criminal information, citizenship status); the loan's eligibility for delegated or expedited processing (e.g., the borrower is not more than 60 days delinquent in child support payments, not proposed or presently excluded from participation in this transaction by any federal department or agency, has no potential for a conflict of interest due to an owner being a current or former SBA employee, a Member of Congress, or a SCORE volunteer); and, among other disclosures, the firm's existing number of employees, the number of jobs to be created as a result of the loan, and the number of jobs that will be retained as a result of the loan that would have otherwise been lost.
SBA form 1920 provides identifying information about the lender; the loan type (standard, SBAExpress, Export Express, etc.); loan terms; use of proceeds; the business's size and information about affiliates, if any; the applicant's character; if credit is reasonably available elsewhere; the type of business; potential conflicts of interest; and other information such the number of jobs created or retained.
P.L. 111-240, the Small Business Jobs Act of 2010 P.L. 111-240 provided $505 million (plus $5 million for administrative expenses) to extend the 7(a) program's 90% maximum loan guaranty percentage and 7(a) and 504/CDC loan guaranty programs' fee subsidies through December 31, 2010 (later extended to March 4, 2011), or until available funding was exhausted (which occurred on January 3, 2011).
In addition to increasing the 7(a) program's authorization limit for FY2015, the act added requirements designed to ensure that SBA loans do not displace private sector loans (e.g., the SBA Administrator may not guarantee a 7(a) loan if the lender determines that the borrower is unable to obtain credit elsewhere solely because the liquidity of the lender depends upon the guarantied portion of the loan being sold on the secondary market, or if the sole purpose for requesting the guarantee is to allow the lender to exceed the lender's legal lending limit), and requires the SBA to report, on a quarterly basis, specified 7(a) program statistics to the House and Senate Committees on Appropriations and Small Business.
The SBA is required to provide at least 30 days' notice of its intent to exceed the 7(a) loan program's authorization limit to the House and Senate Committees on Small Business and the House and Senate Committees on Appropriations' Subcommittees on Financial Services and General Government and may exercise this option only once per fiscal year.
The SBA is required to provide at least 30 days' notice of its intent to exceed the 7(a) loan program's authorization limit to the House and Senate Committees on Small Business and the House and Senate Committees on Appropriations' Subcommittees on Financial Services and General Government and may exercise this option only once per fiscal year.
The program is designed to increase the availability of credit to small businesses by permitting lenders to use their existing documentation and procedures in return for receiving a reduced SBA guaranty on loans.
In addition, P.L. 114-38 , the Veterans Entrepreneurship Act of 2015, provided statutory authorization and made permanent the veteran's fee waiver in the SBAExpress program, except during any upcoming fiscal year for which the President's budget, submitted to Congress, includes a cost for the 7(a) program, in its entirety, that is above zero."
45,"Both FS and BLM timber sale planning and implementation proceed under similar principles of achieving multiple use and sustained yield.
The report describes general statutory authorities and regulations, planning activities, timber sales, and trends in the volume and value of timber harvested, first from FS lands, and then for BLM lands.
Planning, Sale Process, and Revenues Congress has directed FS to engage in long-term land use and resource management.
In the case of timber, plans describe where timber harvesting may occur and include measures of sustainable timber harvest levels, and are used to guide implementation of individual sales.
In general, harvest volume and value by region is a function of many complex factors, including the dominant timber type, age class, and condition; the suitability of FS sites for harvest operations; the legal limitations on land uses; and the status of the local forest products industry.
Planning, Sale Process, and Receipts Congress has directed BLM to engage in long-term land use and resource management planning .
As with the NFS, in general, BLM harvest volume and value is a function of many complex factors, including the dominant timber type, age class, and condition; the suitability of sites for harvest operations; legal limitations on land uses; and the status of the local forest products industry.
Issues for Congress Management of federal lands for multiple uses and sustained yield is challenging, including balancing timber harvesting with other uses."
46,"As treatment of the individual elements makes clear, however, there seems little dispute that conviction requires the government to prove the use of either mail or wire communications in the foreseeable furtherance of a scheme and intent to defraud another of either property or honest services involving a material deception.
Scheme to Defraud The mail and wire fraud statutes ""both prohibit, in pertinent part, 'any scheme or artifice to defraud[,]' or to obtain money or property 'by means of false or fraudulent pretenses, representations, or promises,"" or deprive another of the right to honest services by such means.
The bank fraud statute, for example, applies to ""whoever knowingly executes … a scheme or artifice — (1) to defraud a financial institution; or (2) to obtain any of the money, funds, credits, assets, securities, or other property owned by … a financial institution, by means of false or fraudulent pretenses …"" It left the mail and wire fraud statutes, however, unchanged.
Yet materiality is an element of each offense, because at the time of the statutes' enactment, the word ""defraud"" was understood to ""require[] a misrepresentation or concealment of [a] material fact."" Thus, other than in an honest services context, a ""scheme to defraud"" for mail or wire fraud purposes must involve a material misrepresentation of some kind.
The victims entitled to restitution include those directly and proximately harmed by the defendant's crime of conviction, and ""in the case of an offense that involves as an element a scheme, conspiracy, or pattern of criminal activity,"" like mail and wire fraud, ""any person directly harmed by the defendant's conduct in the course of the scheme, conspiracy, or pattern.""  Forfeiture Property that constitutes the proceeds of mail or wire fraud is subject to confiscation by the United States.
Merely depositing the proceeds of a money laundering predicate offense, like mail or wire fraud, does not alone constitute a violation of Section 1956.
There is no explicit authority for confiscation of property tainted by the offense, but either a private individual or the government may bring a civil action for treble damages under the False Claims Act. Section 287 offenses are neither RICO nor money laundering predicate offenses.
To establish the bank- property scheme to defraud offense, ""the Government must prove: (1) the defendant knowingly executed or attempted to execute a scheme or artifice to defraud a financial institution; (2) the defendant did so with the intent to defraud a financial institution; and (3) the financial institution was federally insured."" As for the bank-custody offense, ""the government must prove (1) that a scheme existed to obtain moneys, funds, or credit in the custody of a federally-insured bank by fraud; (2) that the defendant participated in the scheme by means of material false pretenses, representations, or promises; and (3) that the defendant acted knowingly."" Violation of either offense is punishable by imprisonment for not more than 30 years and a fine of not more than $1 million.
The elements of defrauding offense ""are (1) fraudulent intent, (2) a scheme or artifice to defraud, and (3) a nexus with a security."" To prove a violation of Section 1348(2), the government must establish that the defendant (1) executed, or attempted to execute, a scheme or artifice; (2) with fraudulent intent; (3) in order to obtain money or property; (4) by material false or fraudulent pretenses, representations, or promises."
47,"The regulators issue CRA credits, or points, where banks engage in qualifying activities—such as mortgage, consumer, and business lending; community investments; and low-cost services that would benefit low- and moderate-income (LMI) areas and entities—that occur within assessment areas (where institutions have local deposit-taking operations).
The CRA requires federal banking regulatory agencies to evaluate the extent to which regulated institutions are effectively meeting the credit needs within their designated assessment areas, including LMI neighborhoods, in a manner consistent with the federal prudential regulations for safety and soundness .
It begins with a description of bank CRA examinations, including how a bank delineates its assessment area; the activities that may qualify for points under the three tests (i.e., lending, investment, and service) that collectively make up the CRA examination; and how the composite CRA rating is calculated.
The regulators issue CRA credits, or points, when banks engage in qualifying activities—such as mortgage, consumer, and business lending; community investments; and low-cost services that would benefit LMI areas and entities—that occur within assessment areas.
Qualifying CRA activities include mortgage, consumer, and business lending; community investments; and low-cost services that would benefit LMI areas and entities.
For example, banks may receive CRA credits for such activities as  investing in special purpose community development entities (CDEs), which facilitate capital investments in LMI communities (discussed below); providing support (e.g., consulting, detailing an employee, processing transactions for free or at a discounted rate, and providing office facilities) to minority- and women-owned financial institutions and low-income credit unions (MWLIs), thereby enhancing their ability to serve LMI customers; serving as a joint lender for a loan originated by MWLIs; facilitating financial literacy education to LMI communities, including any support of efforts of MWLIs and CDEs to provide financial literacy education; opening or maintaining bank branches and other transactions facilities in LMI communities and designated disaster areas; providing low-cost education loans to low-income borrowers; and offering international remittance services in LMI communities.
The CRA Examination Tests Regulators apply up to three tests, which are known as the lending , investment , and service tests, respectively, to determine whether a bank is meeting local credit need in designated assessment areas.
Although banks may receive CRA consideration under the investment test for purchasing state and local municipal bonds that fund public and community development projects in their designated assessment areas, banks may choose this investment for reasons unrelated to CRA.
Furthermore, banks receive CRA investment consideration when purchasing state and local municipal bonds that fund public and community development projects in their designated assessment areas.
Hence, banks may view EQ2s as a potentially profitable opportunity to invest in other specialized financial institutions and receive CRA consideration, particularly when the funds are subsequently used by CDFIs to originate loans in the banks' assessment areas."
48,"The Armored Multi-Purpose Vehicle (AMPV)2 According to the Army The Armored Multi-Purpose Vehicle (AMPV) is the proposed United States Army program for replacement of the M-113 Family of Vehicles (FOV) to mitigate current and future capability gaps in force protection, mobility, reliability, and interoperability by mission role variant within the Heavy Brigade Combat Team (HBCT) [now known as the Armored Brigade Combat Team – ABCT].
Other Program Issues DOD Inspector General (IG) Concerns29 An April 28, 2017, DOD IG report noted the Army has effectively managed the AMPV program, in particular keeping it within cost requirements and scheduled timeframes, but also expressed the following concerns: The program might not meet entry requirements for initial production and testing (Milestone C) because the Army has not fully resolved vehicle performance and design demonstration concerns.
Potential Revised AMPV Procurement Rate  As previously noted, on March 13, 2019, Army leadership reportedly announced the Army had decided to cut funding over the next five years for 93 programs—including the AMPV—to increase available funding for its new modernization strategy."
49,"It may be argued, however, that the granting of emergency powers by Congress is implicit in its Article I, Section 8, authority to ""provide for the common Defense and general Welfare;"" the commerce clause; its war, armed forces, and militia powers; and the ""necessary and proper"" clause empowering it to make such laws as are required to fulfill the executions of ""the foregoing Powers, and all other Powers vested by this Constitution in the Government of the United States, or in any Department or Officer thereof."" There is a tradition of constitutional interpretation that has resulted in so-called implied powers, which may be invoked in order to respond to an emergency situation.
In 1973, a Senate special committee studying emergency powers published a compilation identifying some 470 provisions of federal law delegating to the executive extraordinary authority in time of national emergency.
The Emergency Concept Relying upon constitutional authority or congressional delegations made at various times over the past 230 years, the President of the United States may exercise certain powers in the event that the continued existence of the nation is threatened by crisis, exigency, or emergency circumstances.
During the Wilson and Roosevelt presidencies, a major procedural development occurred in the exercise of emergency powers—use of a proclamation to declare a national emergency and thereby activate all standby statutory provisions delegating authority to the President during a national emergency.
There was some annoyance that the President was retaining extraordinary powers intended only for a time of genuine emergency and a feeling that the Chief Executive was thwarting the legislative intent of Congress by continuously failing to terminate the declared national emergency.
A title of the Federal Civil Defense Act of 1950 granting the President or Congress power to declare a civil defense emergency in the event of an attack on the United States occurred or was anticipated expired in June 1974 after the House Committee on Rules failed to report a measure continuing the statute."
50,"As treatment of the individual elements makes clear, however, there seems little dispute that conviction requires the government to prove (1) the use of either mail or wire communications in the foreseeable furtherance, (2) of a scheme and intent to defraud another of either property or honest services, (3) involving a material deception.
Scheme to Defraud The mail and wire fraud statutes ""both prohibit, in pertinent part, 'any scheme or artifice to defraud[,]' or to obtain money or property 'by means of false or fraudulent pretenses, representations, or promises,"" or to deprive another of the right to honest services by such means.
The mail and wire fraud statutes speak of schemes to defraud or to obtain money or property by means of false or fraudulent pretenses.
The bank fraud statute, for example, applies to ""whoever knowingly executes … a scheme or artifice – (1) to defraud a financial institution; or (2) to obtain any of the money, funds, credits, assets, securities, or other property owned by … a financial institution, by means of false or fraudulent pretenses …"" It left the mail and wire fraud statutes, however, unchanged.
Yet materiality is an element of each offense, because at the time of the statutes' enactment, the word ""defraud"" was understood to ""require[] a misrepresentation or concealment of [a] material fact."" Thus, other than in an honest services context, a ""scheme to defraud"" for mail or wire fraud purposes must involve a material misrepresentation of some kind.
The victims entitled to restitution include those directly and proximately harmed by the defendant's crime of conviction, and ""in the case of an offense that involves as an element a scheme, conspiracy, or pattern of criminal activity,"" like mail and wire fraud, ""any person directly harmed by the defendant's conduct in the course of the scheme, conspiracy, or pattern.""  Forfeiture .
The elements of defrauding offense ""are (1) fraudulent intent, (2) a scheme or artifice to defraud, and (3) a nexus with a security."" To prove a violation of Section 1348(2), the government must establish that the defendant (1) executed, or attempted to execute, a scheme or artifice; (2) with fraudulent intent; (3) in order to obtain money or property; (4) by material false or fraudulent pretenses, representations, or promises."
51,"In some past Congresses, the House Financial Services Committee had adopted a committee rule that prohibited its Domestic Monetary Policy and Technology Subcommittee from holding a hearing on commemorative medal legislation—including Congressional Gold Medals—""unless the legislation is cosponsored by at least two-thirds of the members of the House."" Informal practices regarding cosponosrship requirements, however, may still exist.
Other Statutory Limitations Although Congress has approved legislation stipulating requirements for numerous other awards and decorations, there are no permanent statutory provisions specifically relating to the creation of Congressional Gold Medals.
For example, legislation authorizing the 65 th Infantry Regiment, known as the Borinqueneers, Congressional Gold Medal stated the following: Status of Medals Gold medal legislation generally contains a statement that these awards are considered as national medals for the purpose of the U.S. Mint's statutory requirements for producing medals.
Currently, the House Financial Services Committee has not adopted any specific rules concerning committee consideration of Congressional Gold Medal legislation, although it has required a minimum number of cosponsors in past Congresses for committee consideration."
