,text
0,"Introduction On January 5, 2011, the House of Representatives adopted an amendment to House Rule XII to require that Members of the House state the constitutional basis for Congress's power to enact the proposed legislation when introducing a bill or joint resolution.
The report concludes by discussing trends with regard to the House's recent CAS practices and by providing considerations for congressional personnel drafting CASs. The report contains two tables: Table 1 identifies the constitutional provisions most commonly cited in CASs during the last six months of the 114 th and 115 th Congresses, and Table 2 lists suggested constitutional authorities for various types of legislation.
Specifically, that clause provides Congress with the power to make ""all Laws which shall be necessary and proper for carrying into Execution the foregoing Powers and all other Powers vested by this Constitution in the Government of the United States, or in any Department or Officer thereof."" The Supreme Court has interpreted the scope of Congress's power under the Necessary and Proper Clause as ""broad,"" in that the clause leaves to ""Congress a large discretion as to the means that may be employed in executing a given power."" In so holding, the Court has described the clause as providing the ""broad power to enact laws that are 'convenient, or useful' or 'conducive' to"" a more specific authority's ""beneficial exercise."" Consistent with this view, the Court has upheld legislation criminalizing perjury and witness tampering as an extension of Congress's power to constitute federal tribunals.
For instance, the Supreme Court has identified federalism-based constraints stemming from the Tenth Amendment—the provision of the Bill of Rights that reads, ""The powers not delegated to the United States by the Constitution, nor prohibited by it to the States, are reserved to the States respectively, or to the people."" More specifically, the Court has interpreted the Tenth Amendment to prevent the federal government from ""commandeering"" or requiring state executive officers or state legislators to carry out federal directives.
Among the most prominent examples of CASs that could be seen as adopting an interpretation of the Constitution that potentially diverges from historical understandings or judicial interpretations of a particular clause include statements that cite to the following clauses: Necessary and Proper Clause : One of the most frequently cited clauses in recent CASs was the Necessary and Proper Clause, which allows Congress to ""make all Laws which shall be necessary and proper for carrying into Execution"" the powers enumerated in Article I and ""all other Powers vested by [the] Constitution in the Government of the United States, or in any Department or Officer thereof."" About a quarter of all CASs in the CRS studies contained a citation to that clause, with 14% of the 2016 CASs and 19% of the 2018 CASs citing the Necessary and Proper Clause as the sole power to enact the underlying legislation.
Citations to the Necessary and Proper Clause in isolation could be seen as somewhat anomalous, as that clause has never been viewed by the Court or by the Framers of the Constitution as a general source of power for Congress to do whatever is ""necessary and proper."" Instead, ""[w]hile the Necessary and Proper Clause authorizes congressional action 'incidental to [an enumerated] power, and conducive to its beneficial exercise,'"" it does not provide Congress with ""great substantive and independent power."" General Welfare Clause: The General Welfare Clause refers to a specific phrase contained within the language in Article I, Section 8, clause 1 empowering Congress to enact certain taxes and spend the money collected from taxation.
Another alternative would be the enforcement power of the Fourteenth Amendment, which the Supreme Court has held allows ""Congress [to] enact so-called prophylactic legislation"" aimed at ""prevent[ing] and deter[ing] unconstitutional conduct."" Nonetheless, it should be noted that the House Rules Committee has suggested that a citation to a provision of the Constitution that does not explicitly grant power to Congress may suffice to comply with the CAS rule.
Finally, several commentators have proposed altering the rule so that Members must not only cite to the Constitution's affirmative grants of authority to Congress, but also discuss any potential limitations the Constitution may impose on Congress's power to legislate."
